[
  {
    "id": "hub-key-art",
    "gameId": "hub",
    "role": "key-art",
    "sourceFile": "art/source/hub/hub-key-art.png",
    "runtimeFile": "apps/hub/public/assets/hub-key-art.webp",
    "prompt": "Premium vertical 2D game key art for a Chinese mobile H5 game collection, one coherent fantasy arcade pavilion at night where three portals meet: neon mechanical ruins, an eastern monster street market with lantern smoke, and a high-fantasy three-lane fortress, richly painted characters in the middle distance, cinematic depth, luminous atmosphere, sophisticated commercial mobile game illustration, strong readable silhouettes, dark lower area reserved for interface, no text, no logos, no watermark, no mockup frame.",
    "generatedAt": "2026-07-29T01:41:44.071Z",
    "usage": "大厅竖屏主视觉和三个世界的统一入口背景",
    "sha256": "b70ae7f0fb2d1661606d9f0f9b2dd52209432600408b451c5d8042d7321ae366",
    "humanRevisionStatus": "approved",
    "notes": "使用内置 imagegen 生成，人工审图通过并完成 360x800、390x844、430x932 可读性检查"
  },
  {
    "id": "ricochet-card",
    "gameId": "hub",
    "role": "scene",
    "sourceFile": "art/source/hub/ricochet-card.png",
    "runtimeFile": "apps/hub/public/assets/ricochet-card.webp",
    "prompt": "Premium horizontal 2D mobile game key art, a charismatic armored young hero launched as a glowing ricochet capsule through neon mechanical ruins, smashing a boss armor plate while sparks, trajectory trails and controlled chain explosions cross the scene, cyan and hot orange palette, strong focal silhouette, three-layer environmental depth, commercial game illustration, no text, no logo, no watermark, no interface.",
    "generatedAt": "2026-07-29T01:41:44.071Z",
    "usage": "弹珠暴走团大厅入口卡，表达战术弹射和部位破坏",
    "sha256": "d254f6d15d02a6c7f96058ca87770a6dd1de3c36d8d3a050999b561fbc280ad8",
    "humanRevisionStatus": "approved",
    "notes": "使用内置 imagegen 生成，人工审图通过并完成 360x800、390x844、430x932 可读性检查"
  },
  {
    "id": "night-market-card",
    "gameId": "hub",
    "role": "scene",
    "sourceFile": "art/source/hub/night-market-card.png",
    "runtimeFile": "apps/hub/public/assets/night-market-card.webp",
    "prompt": "Premium horizontal 2D mobile game key art, a young monster chef and a tiny stove spirit serving spectacular dishes to expressive eastern folklore monster customers at a lantern night market, steam, fire ribbon and ice reaction forming a celebratory chain, warm amber and jade palette, distinctive character silhouettes, layered street depth, commercial game illustration, no text, no logo, no watermark, no interface.",
    "generatedAt": "2026-07-29T01:41:44.071Z",
    "usage": "怪兽夜市大厅入口卡，表达行列配方与顾客庆典",
    "sha256": "63c44da8dfbdfefaf14c3d638a8346563c7774461db1095e38a66ea9c7b4f95b",
    "humanRevisionStatus": "approved",
    "notes": "使用内置 imagegen 生成，人工审图通过并完成 360x800、390x844、430x932 可读性检查"
  },
  {
    "id": "three-lane-card",
    "gameId": "hub",
    "role": "scene",
    "sourceFile": "art/source/hub/three-lane-card.png",
    "runtimeFile": "apps/hub/public/assets/three-lane-card.webp",
    "prompt": "Premium horizontal 2D mobile game key art, five high-fantasy expedition heroes urgently redeploying across three visible defensive lanes as a colossal boss charges a spell, shield wall, ranger shot and mage interrupt converging on one marked target, violet blue and gold palette, clear tactical lane readability, layered forest ruin fortress, commercial game illustration, no text, no logo, no watermark, no interface.",
    "generatedAt": "2026-07-29T01:41:44.071Z",
    "usage": "三路小队大厅入口卡，表达换路救场和集火打断",
    "sha256": "6fb0eb0ba22413821e37e7a14e4fcfedf42064c54259e508d677d3fb1ba0b94b",
    "humanRevisionStatus": "approved",
    "notes": "复用三路小队已生成并审图通过的正式概念原画，完成大厅卡图裁切导出"
  }
]
